{
  "manifestVersion": "mock-evidence-v1",
  "datasetVersion": "mock-eval-v1",
  "mockData": true,
  "executionIdentities": [
    {"identityCode":"mock-cross-product-reviewer","roles":["REVIEWER"],"productLineCodes":["STREAMING","TDH"],"mockData":true},
    {"identityCode":"mock-streaming-engineer","roles":["SLA_ENGINEER"],"productLineCodes":["STREAMING"],"mockData":true},
    {"identityCode":"mock-tdh-engineer","roles":["SLA_ENGINEER"],"productLineCodes":["TDH"],"mockData":true}
  ],
  "evidenceFixtures": [
    {"evidenceId":"mock-ev-stream-citation","productLineCode":"STREAMING","language":"EN","title":"模拟数据：STREAMING immutable citation guide","excerpt":"模拟数据：引用必须绑定稳定 Evidence ID。","mockData":true},
    {"evidenceId":"mock-ev-stream-en-guide","productLineCode":"STREAMING","language":"EN","title":"模拟数据：STREAMING English operations guide","excerpt":"模拟数据：Use the authorized STREAMING operations procedure.","mockData":true},
    {"evidenceId":"mock-ev-stream-fts-ops","productLineCode":"STREAMING","language":"EN","title":"模拟数据：STREAMING full-text fallback","excerpt":"模拟数据：When embedding is unavailable, use authorized full-text evidence.","mockData":true},
    {"evidenceId":"mock-ev-stream-isr","productLineCode":"STREAMING","language":"MIXED","title":"模拟数据：Kafka ISR shrink KAFKA-1002","excerpt":"模拟数据：KAFKA-1002 表示模拟 ISR 收缩事件。","mockData":true},
    {"evidenceId":"mock-ev-stream-throughput","productLineCode":"STREAMING","language":"EN","title":"模拟数据：Broker throughput troubleshooting","excerpt":"模拟数据：Check the mock broker throughput indicators.","mockData":true},
    {"evidenceId":"mock-ev-stream-zh-guide","productLineCode":"STREAMING","language":"ZH","title":"模拟数据：STREAMING 中文运维指南","excerpt":"模拟数据：用于英文问题检索中文资料的固定证据。","mockData":true},
    {"evidenceId":"mock-ev-tdh-citation-hash","productLineCode":"TDH","language":"ZH","title":"模拟数据：TDH 不可变引用核验","excerpt":"模拟数据：引用须保持稳定 Evidence ID 与内容摘要。","mockData":true},
    {"evidenceId":"mock-ev-tdh-dynamic-partition","productLineCode":"TDH","language":"MIXED","title":"模拟数据：hive.exec.dynamic.partition 配置","excerpt":"模拟数据：固定配置键用于精确词检索。","mockData":true},
    {"evidenceId":"mock-ev-tdh-en-guide","productLineCode":"TDH","language":"EN","title":"模拟数据：TDH English operations guide","excerpt":"模拟数据：Use the authorized TDH procedure for cross-language retrieval.","mockData":true},
    {"evidenceId":"mock-ev-tdh-error-40401","productLineCode":"TDH","language":"ZH","title":"模拟数据：TDH-40401 错误处理","excerpt":"模拟数据：TDH-40401 是固定模拟错误码。","mockData":true},
    {"evidenceId":"mock-ev-tdh-fts-ops","productLineCode":"TDH","language":"ZH","title":"模拟数据：TDH 全文检索降级","excerpt":"模拟数据：向量能力不可用时仅使用授权全文证据。","mockData":true},
    {"evidenceId":"mock-ev-tdh-inceptor-latency","productLineCode":"TDH","language":"MIXED","title":"模拟数据：Inceptor query latency","excerpt":"模拟数据：固定的 Inceptor 延迟排查资料。","mockData":true},
    {"evidenceId":"mock-ev-tdh-query-performance","productLineCode":"TDH","language":"ZH","title":"模拟数据：TDH 查询性能排查","excerpt":"模拟数据：用于语义改写后的查询性能检索。","mockData":true},
    {"evidenceId":"mock-ev-tdh-zh-guide","productLineCode":"TDH","language":"ZH","title":"模拟数据：TDH 中文运维指南","excerpt":"模拟数据：用于跨语言检索的中文固定证据。","mockData":true}
  ]
}
